{
  "schema_version": "circuit-model.v1",
  "request_id": "test",
  "project_id": "stm32f103-minimal-system",
  "topology": "stm32f103_minimal_system",
  "components": [
    {
      "ref": "U1",
      "role": "mcu",
      "value": "STM32F103C8T6",
      "package": "LQFP-48",
      "selected_part": {
        "lcsc_id": "C8734",
        "display_name": "STM32F103C8T6"
      }
    },
    {
      "ref": "U2",
      "role": "main_3v3_regulator",
      "value": "AMS1117-3.3",
      "package": "SOT-223",
      "selected_part": {
        "lcsc_id": "C6186",
        "display_name": "AMS1117-3.3"
      }
    },
    {
      "ref": "Y1",
      "role": "main_8mhz_xtal",
      "value": "8MHz",
      "package": "CRYSTAL-SMD_3225",
      "selected_part": {
        "lcsc_id": "C39097",
        "display_name": "SiT8008AI-22-33E-8.000000D"
      }
    },
    {
      "ref": "C1",
      "role": "vdd_decoupling_1",
      "value": "100nF",
      "package": "C0603",
      "selected_part": {
        "lcsc_id": "C1590",
        "display_name": "CL10B104KA8NNNC"
      }
    },
    {
      "ref": "C2",
      "role": "vdd_decoupling_2",
      "value": "100nF",
      "package": "C0603",
      "selected_part": {
        "lcsc_id": "C1590",
        "display_name": ""
      }
    },
    {
      "ref": "C3",
      "role": "vdd_decoupling_3",
      "value": "100nF",
      "package": "C0603",
      "selected_part": {
        "lcsc_id": "C1590",
        "display_name": ""
      }
    },
    {
      "ref": "C5",
      "role": "vdd_bulk_cap",
      "value": "10uF",
      "package": "C0805",
      "selected_part": {
        "lcsc_id": "C1713",
        "display_name": "CL21A106KOQNNNE"
      }
    },
    {
      "ref": "C6",
      "role": "reg_input_cap",
      "value": "10uF",
      "package": "C0805",
      "selected_part": {
        "lcsc_id": "C1713",
        "display_name": ""
      }
    },
    {
      "ref": "C7",
      "role": "reg_output_cap",
      "value": "10uF",
      "package": "C0805",
      "selected_part": {
        "lcsc_id": "C1713",
        "display_name": ""
      }
    },
    {
      "ref": "C8",
      "role": "hse_load_cap_1",
      "value": "22pF",
      "package": "C0603",
      "selected_part": {
        "lcsc_id": "C1653",
        "display_name": "CL10C220JB8NNNC"
      }
    },
    {
      "ref": "C9",
      "role": "hse_load_cap_2",
      "value": "22pF",
      "package": "C0603",
      "selected_part": {
        "lcsc_id": "C1653",
        "display_name": ""
      }
    },
    {
      "ref": "R1",
      "role": "nrst_pullup",
      "value": "10K",
      "package": "R0603",
      "selected_part": {
        "lcsc_id": "C15401",
        "display_name": "0603WAJ0103T5E"
      }
    },
    {
      "ref": "R2",
      "role": "boot0_pulldown",
      "value": "10K",
      "package": "R0603",
      "selected_part": {
        "lcsc_id": "C15401",
        "display_name": ""
      }
    },
    {
      "ref": "R3",
      "role": "led_resistor",
      "value": "1K",
      "package": "R0603",
      "selected_part": {
        "lcsc_id": "C14676",
        "display_name": "RC0603JR-071KL"
      }
    },
    {
      "ref": "D1",
      "role": "power_led",
      "value": "LED0603",
      "package": "LED0603",
      "selected_part": {
        "lcsc_id": "C5139863",
        "display_name": "APHD1608LCGCK"
      }
    },
    {
      "ref": "J1",
      "role": "usb_c_power_input",
      "value": "USB-C16PIN",
      "package": "USB-C-SMD",
      "selected_part": {
        "lcsc_id": "C2927026",
        "display_name": "USB-TYPE-C-006"
      }
    },
    {
      "ref": "J2",
      "role": "swd_debug_header",
      "value": "SWD-4P",
      "package": "HDR-TH_4P",
      "selected_part": {
        "lcsc_id": "C36717",
        "display_name": "2.54mm 1*2P"
      }
    },
    {
      "ref": "SW1",
      "role": "reset_button",
      "value": "SW-TH_6x6",
      "package": "SW-TH",
      "selected_part": {
        "lcsc_id": "C8363",
        "display_name": "STM32F103TBU6"
      }
    }
  ],
  "nets": [
    {
      "name": "+5V",
      "kind": "power",
      "members": [
        "J1.1",
        "U2.1"
      ]
    },
    {
      "name": "+3V3",
      "kind": "power",
      "members": [
        "U1.9",
        "U1.24",
        "U1.36",
        "U1.48",
        "U1.1",
        "U2.4",
        "R1.1",
        "D1.1",
        "J2.1",
        "C1.1",
        "C2.1",
        "C3.1",
        "C5.1",
        "C7.1"
      ]
    },
    {
      "name": "GND",
      "kind": "ground",
      "members": [
        "U1.8",
        "U1.23",
        "U1.35",
        "U1.47",
        "U1.2",
        "U2.2",
        "R2.2",
        "R3.2",
        "SW1.2",
        "C1.2",
        "C2.2",
        "C3.2",
        "C5.2",
        "C6.2",
        "C7.2",
        "C8.2",
        "C9.2",
        "D1.2",
        "J1.2",
        "J2.4"
      ]
    },
    {
      "name": "NRST",
      "kind": "signal",
      "members": [
        "U1.7",
        "R1.2",
        "SW1.1"
      ]
    },
    {
      "name": "BOOT0",
      "kind": "signal",
      "members": [
        "U1.44",
        "R2.1"
      ]
    },
    {
      "name": "HSE_IN",
      "kind": "signal",
      "members": [
        "U1.5",
        "Y1.1",
        "C8.1"
      ]
    },
    {
      "name": "HSE_OUT",
      "kind": "signal",
      "members": [
        "U1.6",
        "Y1.3",
        "C9.1"
      ]
    },
    {
      "name": "LED",
      "kind": "signal",
      "members": [
        "U1.13",
        "R3.1"
      ]
    },
    {
      "name": "SWCLK",
      "kind": "signal",
      "members": [
        "U1.37",
        "J2.3"
      ]
    },
    {
      "name": "SWDIO",
      "kind": "signal",
      "members": [
        "U1.34",
        "J2.2"
      ]
    }
  ],
  "sheets": [
    {
      "name": "power",
      "components": [
        "J1",
        "U2",
        "C6",
        "C7",
        "C1",
        "C2",
        "C3",
        "C5"
      ],
      "nets": [
        "+5V",
        "+3V3",
        "GND"
      ]
    },
    {
      "name": "mcu",
      "components": [
        "U1",
        "Y1",
        "C8",
        "C9",
        "R1",
        "R2",
        "SW1"
      ],
      "nets": [
        "+3V3",
        "GND",
        "NRST",
        "BOOT0",
        "HSE_IN",
        "HSE_OUT"
      ]
    },
    {
      "name": "io",
      "components": [
        "R3",
        "D1",
        "J2"
      ],
      "nets": [
        "+3V3",
        "GND",
        "LED",
        "SWCLK",
        "SWDIO"
      ]
    }
  ],
  "calculations": [],
  "design_decisions": [],
  "risks": [],
  "constraints": [],
  "pcb_layout": {
    "regions": {
      "power_input": {
        "x": 10,
        "y": 10,
        "rotation": 90,
        "components": [
          "J1"
        ]
      },
      "regulation": {
        "x": 10,
        "y": 50,
        "components": [
          "U2",
          "C6",
          "C7"
        ]
      },
      "decoupling": {
        "x": 70,
        "y": 10,
        "components": [
          "C1",
          "C2",
          "C3",
          "C5"
        ]
      },
      "mcu": {
        "x": 10,
        "y": 100,
        "components": [
          "U1"
        ]
      },
      "clock": {
        "x": 70,
        "y": 100,
        "components": [
          "Y1",
          "C8",
          "C9"
        ]
      },
      "reset_boot": {
        "x": 10,
        "y": 160,
        "components": [
          "R1",
          "R2",
          "SW1"
        ]
      },
      "led_io": {
        "x": 70,
        "y": 160,
        "components": [
          "D1",
          "R3",
          "J2"
        ]
      }
    }
  }
}
