{
  "schema_version": "circuit-model.v1",
  "request_id": "agent-create_hardware_project-20260527T185449Z",
  "project_id": "rp2040-minimal",
  "topology": "rp2040_minimal",
  "components": [
    {
      "ref": "U1",
      "role": "rp2040_mcu",
      "value": "RP2040",
      "package": "QFN-56_L7.0-W7.0-P0.4-EP"
    }
  ],
  "nets": [],
  "calculations": [],
  "design_decisions": [],
  "risks": [],
  "constraints": [],
  "sheets": []
}
